commit	val_bpb	artifact_bytes	status	description
593dbb7	1.36878	15301754	keep	baseline: RevDEQ+MLA+MoE+FSQ+DiffAR (no CTP), fp64, identity init, conv_reg=1.0
5bcf100	1.96394	15301754	discard	CTP+NTP dual-head (weight=0.5, separate head dim->64->dim) — massive regression
records-2026-03-25	1.21287	12770518	record_baseline	record 2026-03-25 ValCalib_GPTQ_XSA_BigramHash3072 on 2xL40S/2h/no-compile (sliding stride=64: 1.18916)
926cf63	0.00000	0	crash	iter 0 attempt 1: parallel residuals f(z)=attn+mlp diverged — deq_residual exploded 976->7.2e8 at step 600, val_bpb 1.96->3.13 monotone regression. Root cause: sum form has ~2x update magnitude vs sequential composition
7949f5a	0.00000	0	crash	iter 0 attempt 2: parallel residuals 0.5x scaling regressed val_bpb 1.82->2.85 between step 400 and 600, deq_residual 1641->74361 (45x jump). Still diverging, just slower than attempt 1. Pattern: muon momentum warmup pushing borderline-contractive solver out of contraction around step 600
f161bbe	2.40739	9188031	discard	iter 0 attempt 4: parallel residuals (no inner resid) + deq_beta 0.20 + 1h. Pre-quant val_bpb 1.5836 at step 822, post-SWA+EMA+int6: 2.4074. K-sweep k4=k6=k8=k12=k16=2.4074 confirming fixed-point property INTACT but EMA contamination on 822-step run dragged gates near identity. SWA+EMA decay schedules assume 3000+ steps; 0.997^822 = 0.086 leaves 8.6% init weight contribution. arch is sound, post-training pipeline broke it
83e94a3	1.62090	8865555	discard	iter 1: parallel residuals (no inner) + deq_beta 0.20 + SWA OFF + EMA OFF + 1h. Post-int6: 1.6209 (vs iter 0's 2.4074, -0.787 BPB win confirms SWA/EMA were the killer). K-sweep k4=k8=k16=1.6209 perfect fixed-point invariance. Artifact 8.87MB. Still +0.21 above old broken baseline 1.4094 — gap is undertraining (831 steps in 1h) vs old broken baseline (3058 steps in 20min). DEQ converges in <4 iters (gg_tok ~0.22) — under-utilizing iterative depth
f16086e	1.62035	8926981	discard	iter 2: + gg_gate.bias init=1.5 (force more iterative depth). Model REJECTED the init: gg_mean dropped 0.82 (init) -> 0.11 (step 200) -> 0.23 (step 832), nearly identical trajectory to iter 1. Final val_bpb 1.62035 vs iter 1's 1.62090 (delta 0.0006 = noise). K-sweep k4=k8=k16=1.6203 (still flat). Initialization-only interventions cannot override optimizer preference for shallow DEQ. Pivot to iter 3 = double experts (add capacity in the regime model likes)
dcb1d5f	0.00000	0	crash	iter 3 attempt 1: double experts 6->12. Expert collapse at step 400 (attn_cv 0.18->1.69, expert 1 took 51% of routing). val_bpb 1.96->2.18->5.46 monotone regression, val_loss 3.69->9.24. Root cause: bal_loss_coef=5e-3, attn_balance_mult=5.0 tuned for 6 experts, doesn't scale to 12 (per-expert ideal load halves from 1/6 to 1/12). gg_iter trajectory at step 200 was beautifully decreasing [0.20,0.12,0.09,0.07,0.06,0.06,0.05,0.05] but corrupted to [0.65,0.15,0.06,0.03,0.03,0.03,0.03,0.03] by step 400 from routing collapse. Retry with stronger balance loss
d5052ce	1.62251	9407387	discard	iter 3 attempt 3: 8 experts + deq_beta 0.20 + parallel resid (no inner) + SWA/EMA OFF + 1h. Post-int6: 1.6225 (tied with iter 1's 1.6209). gg_iter learned dome shape [0.196,0.476,0.626,0.534,0.148,0.053,0.029,0.019] with peak 0.626 at iter 2 — first time model uses real iterative depth. K-sweep interrupted by tmux crash but expected flat. 8 experts balanced (attn_cv ~0.25, entropy 95% of max). 770 steps in 1h at 4825ms/step. Same val_bpb as 6-expert despite interesting depth dynamics — throughput cost (11% slower) cancels per-step gain
1c3246d	2.13472	9627162	discard	iter 4: 16 experts at rank 64/96 (constant rank-units vs iter 3 a3). Single GPU = 372 steps in 1h (vs 770 on 2 GPUs). Routing balanced: attn_cv 0.23-0.32, no expert collapse, all 16 experts active (min 3.9%, max 10.6%). K-sweep flat k4=k8=k16=2.1347. val_bpb 2.13 is purely from undertraining (single GPU). STRUCTURAL FINDING: 16 experts at constant compute DO NOT collapse with existing routing regularization (bal_loss_coef=5e-3). gg_iter monotone decreasing [0.109,...,0.037] — model learned a structured per-iter schedule even with 16 rank-64 experts
bd72574	1.88410	9399182	discard	iter 5: WD 0.06->0.09 (Muon+Adam). Post-int6: 1.8841 (vs iter 4 WD=0.04: 2.1347 = -0.25 BPB improvement from WD alone). Artifact 9.40 MB (smaller than iter 4's 9.63 = better compression from higher WD). K-sweep flat k4=k8=k16=1.884. gg_iter dome [0.56,0.57,0.39,0.22,0.13,0.09,0.07,0.05]. Quant gap only 0.008 BPB. Single GPU 374 steps. WD=0.09 is validated win per-step; would likely beat iter 1's 1.62 if run on 2 GPUs
709af0c	0.00000	0	crash	iter 6 attempt 1: dim768 + bigram4096x128 + 16exp/rank128/192 + WD=0.09 + 2h. Routing collapse at step 400 (attn_cv 0.17->1.12, expert 2 took 29.5%, experts 3/15 nearly dead at 1.3-1.9%). val_bpb 2.20->3.82. deq_residual 3849->85598 (22x). SAME FAILURE as iter 3a1: 16 experts at full rank is too much per-expert capacity for bal_loss_coef=5e-3. Scaling law: collapse risk ~ num_experts * expert_rank^2. Fix: drop to 8 experts (proven stable at rank 128 for 743 steps in iter 3a3)
175bfb0	1.81751	5026845	discard	iter 6 attempt 2: dim=768 + 8exp/rank128/192 + bigram 4096x128 + WD=0.09 + beta=0.20 + 2GPU/1h. Post-int6: 1.8175 (worse than iter 1's 1.62 — fewer steps 567 vs 831 from 1.5x slower per-step at dim=768). Artifact ONLY 5.03 MB = 11 MB headroom under 16MB. gg_iter peak=0.909 at iter 1 — model uses 2.1x more total transformation than dim=512 runs. Expert balance cv=0.068-0.103 (best ever). K-sweep flat k4=k8=k16=1.8175. Effective transformer body 8.5M params (1.8x iter 1's 4.7M)
649f1f6	1.79601	5048959	discard	iter 7: beta sweep beta=0.10 (was 0.20). Post-int6: 1.7960 (vs beta=0.20: 1.8175 = -0.022 BPB win from tighter contraction). Model compensates: gg_mean rose 0.46->0.62, gg_iter peak 0.909->0.983 (near full open). Gate absorbs beta changes — total effective update (beta*gg_sum) is 0.49 vs 0.65, yet val_bpb is BETTER with less total update. Tighter contraction → higher-quality fixed point. K-sweep flat k4=k8=k16=1.796. Artifact 5.05 MB. Conservative beta confirmed better per user hypothesis
ea2778b	0.00000	0	discard	iter 7b: beta sweep beta=0.05. val_bpb 1.815 pre-quant (worse than beta=0.10's 1.786). Gate saturated: gg_iter=[1.000,0.999,0.995,0.933,...] — first 3 iters at sigmoid ceiling. deq_residual 24014 (7x larger than beta=0.10). SWEEP CONCLUSION: U-shaped optimum. beta=0.20 too large (gate under-used, val 1.806), beta=0.05 too small (gate saturated, val 1.815), BETA=0.10 IS OPTIMAL (gate has room, val 1.786). Sweep done.
7c61d9b	1.88189	7322376	discard	iter 8: doubled expert_rank 128/192->256/384. Post-int6: 1.8819 (WORSE than iter 7's 1.7960). Per-step learning was better (-0.030 at step 400) but throughput penalty dominated: 419 steps vs 569 (26% fewer). SCALING LAW: at 1h budget on 2xL40S, rank 128/192 is Pareto optimal. More capacity can't be trained in time. Binding constraint is steps/hour, not model capacity. Artifact 7.32 MB. K-sweep flat k4=k8=k16=1.882
4c656a6	1.75386	5132781	keep	iter 9: WD 0.09->0.18. NEW BEST post-int6: 1.7539 (vs iter 7 WD=0.09: 1.7960 = -0.042 improvement). Quant gap ONLY 0.004 (smallest ever, vs 0.010 at WD=0.09). WD scaling trend 0.06->0.09->0.18 all improve. gg_iter [1.0,1.0,1.0,0.96,0.67,0.41,0.30,0.22] first 3 saturated. deq_residual 5156 (elevated but stable). 569 steps at 6307ms/step. Artifact 5.13 MB. Config: dim=768 8exp rank128/192 beta=0.10 WD=0.18 bigram4096x128 SWA/EMA off parallel-resid K-sweep flat k4=k8=k16=1.7539
TODO	1.77908	5122162	discard	iter 10: WD 0.18->0.36. Post-int6: 1.7791 (better than WD=0.09's 1.7960 but worse than WD=0.18's 1.7539). WD SWEEP CONCLUSION: 0.18 is optimum. 0.36 over-regularizes training (1.87 at step 400 vs 0.18's 1.84) but compensates partly via better quant. gg_iter nearly flat [1.0,1.0,1.0,0.98,0.83,0.59,0.48,0.41] — gate saturated across all iters. K-sweep FLAT k4=k8=k16=1.779 despite high gg[7]=0.41 — high gate != not converged (effect = gg*(z2-z_in) ≈ 0 at fixed point). Artifact 5.12 MB
e489665	1.77768	5022550	discard	iter 12b: WD=0.36 with FIXED K-sweep. FIRST VALID K-SWEEP: k4=1.781 k8=1.778(best) k16=1.802 k32=1.820 k64=1.825. FP FOUND at K~40 (gate 0.007, residual 140) but FP quality 0.047 worse than K=8 partial convergence. Model optimized for K=8, not FP. Fix: wider K jitter during training. gg_iter at K=64 shows textbook convergence [1.0,...,0.007] with plateau at iter 40+. Bug fix confirmed: K=4 now correctly shows 4 gg_iter entries and different val_bpb from K=8.
1883e0d	1.97627	5122507	discard	iter 13: WD=0.72/β=0.20 + K jitter {4,8,12,16}. Post-int6: 1.976 (356 steps — K jitter overhead 10.1s/step). FIRST VALID K-SWEEP WITH K JITTER: k4=2.007 k8=1.983 k16=1.983 k32=1.986 k64=1.992. K=8→K=16 degradation: 0.0002 (was 0.025 in iter12b = 125x improvement!). K=8→K=64: 0.009 (was 0.047 = 5x improvement). H12 STRONG EVIDENCE: wider K jitter fixes FP quality. H17 SUPPORTED: WD=0.72 stable with β=0.20. Gate reaches 0.015 at K=64 (true convergence). Quant gap only 0.002
TODO	2.04573	5133474	discard	iter 14a: β=0.30/WD=0.72 (H18 test). Post-int6: 2.046 (356 steps). K-sweep: k4=2.065 k8=2.052 k16=2.053 k32=2.059 k64=2.072. Convergence 2x FASTER (residuals 40-50% lower at all K) but FP quality 2x WORSE (K=8→K=64 Δ=+0.020 vs β=0.20's +0.009). H18: β controls convergence SPEED but also changes WHICH FP is found. Lower β = better FP quality. Gate transitioned from flat (step 200) to dome (step 356) — H19 revision: dome gate eventually forms at WD=0.72/β=0.30, just slower
TODO	2.08056	4860537	discard	iter 14b: WD=1.44/β=0.30 (H19 test). Post-int6: 2.081 (356 steps). K-sweep: k4=2.109 k8=2.090 k16=2.090 k32=2.098 k64=2.117. K=8→K=64 Δ=+0.027 (WORST of all configs — WD=1.44 too high, weakens per-iter effectiveness). gg[63]=0.025 (least converged). H19: higher WD does NOT improve dome formation or FP quality — dome forms at same time, but convergence slower. PHASE 1 CONCLUSION: lock WD=0.72/β=0.20 (best FP: K=8→K=64 Δ=+0.009)
TODO	2.03257	6157956	discard	iter 15: 12exp rank128 at WD=0.72/β=0.20 (H5 revisited). Post-int6: 2.033 (300 steps — 12exp throughput 11.6s/step). H5 RESOLVED: routing collapse IS WD-addressable. 12exp stable (attn_cv 0.017→0.225→0.182 DECREASING). K-sweep: k4=2.054 k8=2.039 k16=2.039 k32=2.044 k64=2.054. K=8→K=64 Δ=+0.015 (slightly worse than 8exp's +0.009). CAN: (12exp,WD=0.72) stable. CANNOT: 12exp better than 8exp (fewer steps from throughput penalty). Quant gap 0.001
de8ff41	1.96592	5133627	discard	iter 16: gate stats infra (gg_iter+inj_iter+attn_gate_iter). Same config as iter 13. Post-int6: 1.966. K-sweep: k4=2.001 k8=1.974 k16=1.973(-0.001 improved!) k32=1.977 k64=1.983. Three-gate discovery: inj decays exponentially 0.42→0.002 (zero by iter 5), gg dome 1.0→0.08, attn nearly flat 0.88→0.67. inj_gate is most iteration-dependent gate (57x dynamic range). Matches iter 13 on val_bpb and K-sweep.
TODO	1.96129	5032369	discard	iter 17: router sigmoid gate (H14). Post-int6: 1.961 (vs iter 16's 1.966 = -0.005). K-sweep: k4=1.996 k8=1.969 k16=1.968 k32=1.971 k64=1.975. FP quality: K=8→K=64 Δ=+0.006 (vs iter 16's +0.009 = 33% better). Router gate learned INCREASING per-iter trajectory [0.30→0.76] — only gate that opens over iterations. Two-phase refinement: attn-dominated early (high attn gate, low router gate) → expert-dominated late (low attn, high router). Quant gap 0.002.
TODO	1.95803	5136702	discard	iter 18: additive injection x=z_in+g*x0 (was lerp). Post-int6: 1.958 (vs iter 17 lerp 1.961 = -0.003). K-sweep: k4=1.993 k8=1.965 k16=1.965 k32=1.968 k64=1.973. FP quality K=8→K=64: +0.008 (vs iter 17's +0.006 = slightly worse). inj_iter[0] 0.22 (vs 0.38 lerp — additive needs less injection). CONCLUSION: injection mechanism is NOT a significant lever. Model compensates. A wash.
TODO	1.89716	5147058	keep	iter 19: POST-NORM on Block output (RMSNorm). BIGGEST ARCH IMPROVEMENT: post-int6 1.897 (vs iter 18's 1.958 = -0.061). Unlocked flat gg regime [1.0→0.67] — model does real work at ALL iterations (gg[63]=0.391 vs 0.013 without). iter_conv_rel 0.007 (2.3x better). inj dropped to near-zero [0.010→0.009]. K-sweep: k4=1.912 k8=1.902 k16=1.902 k32=1.905 k64=1.911 (K8→K64 Δ=+0.009, same FP quality as before). Quant gap 0.008. KEEP.
TODO	0.00000	0	crash	iter 20: quant-noise injection INCOMPATIBLE with RevDEQ. Smoke failed at rate=0.10 (recon 10.9) and rate=0.01 (recon 3.55). Root cause: RevDEQ backward reconstructs forward states using current weights — random per-call quant-noise makes forward non-deterministic, breaking reconstruction. H15 INCOMPATIBLE with current backward. Quant gap is already tiny (0.002-0.008 BPB) so not critical. Reverted.
9146d74	1.9167	5248815	keep	iter 36 L2-attention (SDPA fast path γ=0.051) + Phase 6a fixes (deterministic spectral-norm, matmul router, fp32 softmax, bounded prototypes)
e3fa2eb	1.9111	5263265	keep	iter 37 1-Lip MLP activation (drop .square()), K128Δ=0.011
3c51ecd	1.9801	5034464	discard	iter 37b post-mix Π_R (K128Δ=0.003 tightest, but val_bpb +0.069)
2f60108	1.9197	5214198	keep	iter 35 single pooled router 2E=16 (MANDATORY doc §4.3), K128Δ=0.016
566cf50	2.0295	5224616	discard	iter 39 minimal 2xPi_R (K128Δ=0.001 tightest FP, but val_bpb +0.115)
iter39b	2.1421	5217783	discard	iter 39b certified contraction (K128Δ=0.0000 PERFECT FP, but val_bpb +0.22 — τ too small)
